<?xml version="1.0" encoding="UTF-8"?>

<!-- XML namespaces for vehicle, XSI and XSD -->
<vehicles
	xmlns="http://www.wsd.com/vehicle" 
	xmlns:xsi="http://www.w3.org/2001/XMLSchema-instance"
	xsi:schemaLocation="http://www.wsd.com/vehicle xsd/vehicle.xsd">
	<vehicle>
		<registration>HOLSS1</registration>
		<type>Ute</type>
		<make>Holden</make>
		<model>SS</model>
		<year>2014</year>
		<colour>Red</colour>
		<kilometres>160</kilometres>
	</vehicle>

	<vehicle>
		<registration>FORD88</registration>
		<type>Ute</type>
		<make>Ford</make>
		<model>Falcon</model>
		<year>2008</year>
		<colour>Blue</colour>
		<kilometres>2222</kilometres>
	</vehicle>

	<vehicle>
		<registration>ODH987</registration>
		<type>Minibus</type>
		<make>Mercedes</make>
		<model>Sprinter</model>
		<year>2000</year>
		<colour>Silver</colour>
		<kilometres>222</kilometres>
	</vehicle>
	
	<vehicle>
		<registration>SN28S8</registration>
		<type>Minibus</type>
		<make>Volkswagen</make>
		<model>Kombi</model>
		<year>1992</year>
		<colour>Green</colour>
		<kilometres>22</kilometres>
	</vehicle>
	
	<vehicle>
		<registration>ABC902</registration>
		<type>Car</type>
		<make>Subaru</make>
		<model>Impreza</model>
		<year>2004</year>
		<colour>Blue</colour>
		<kilometres>221</kilometres>
	</vehicle>
	
	<vehicle>
		<registration>BA30HS</registration>
		<type>Car</type>
		<make>Toyota</make>
		<model>Corolla</model>
		<year>2009</year>
		<colour>Grey</colour>
		<kilometres>122</kilometres>
	</vehicle>
</vehicles>