<?xml version="1.0" encoding="UTF-8"?>

<!-- Style/Transform XML document using a XSL file -->
<?xml-stylesheet type="text/xsl" href="xsl/vehicle.xsl"?>

<!-- XML namespaces for vehicle, XSI and XSD -->
<vehicles
	xmlns="http://www.wsd.com/vehicle" 
	xmlns:xsi="http://www.w3.org/2001/XMLSchema-instance"
	xsi:schemaLocation="http://www.wsd.com/vehicle xsd/vehicle.xsd">

	<vehicle>
		<registration>HOLSS1</registration>
		<type>Ute</type>
		<make>Holden</make>
		<model>SS</model>
		<year>2014</year>
		<colour>Red</colour>
		<kilometres>160</kilometres>
	</vehicle>

	<vehicle>
		<registration>FORD88</registration>
		<type>Ute</type>
		<make>Ford</make>
		<model>Falcon</model>
		<year>2008</year>
		<colour>Blue</colour>
		<kilometres>2222</kilometres>
	</vehicle>

	<vehicle>
		<registration>RU486A</registration>
		<type>Minibus</type>
		<make>Hyundai</make>
		<model>i30</model>
		<year>19282</year>
		<colour>White</colour>
		<kilometres>1</kilometres>
	</vehicle>

</vehicles>